,title,urlToImage,url
0,White Sox Trade Zack Collins To Blue Jays For Reese McGuire - MLB Trade Rumors,https://cdn.mlbtraderumors.com/files/2021/04/reese-mcguire-blue-jays-1024x682.jpg,https://www.mlbtraderumors.com/2022/04/white-sox-trade-zack-collins-to-blue-jays-for-reese-mcguire.html
1,'No chance' bum ankle will keep Armando Bacot out of national championship - March Madness,https://i.ytimg.com/vi/B18m9QwEk3M/hqdefault.jpg,https://www.youtube.com/watch?v=B18m9QwEk3M
2,Auburn Tigers star big man Walker Kessler to enter NBA draft - ESPN,https://a4.espncdn.com/combiner/i?img=%2Fphoto%2F2022%2F0219%2Fr976534_1296x729_16%2D9.jpg,https://www.espn.com/mens-college-basketball/story/_/id/33664123/auburn-tigers-star-big-man-walker-kessler-enter-nba-draft
3,Westbrook Throws Down HUGE Last Second Poster - NBA,https://i.ytimg.com/vi/_dyD7boIZBg/maxresdefault.jpg,https://www.youtube.com/watch?v=_dyD7boIZBg
4,Los Angeles Lakers legend Kareem Abdul-Jabbar criticizes some of LeBron James' actions - ESPN,https://a1.espncdn.com/combiner/i?img=%2Fphoto%2F2022%2F0403%2Fr994941_1296x729_16%2D9.jpg,https://www.espn.com/nba/story/_/id/33664003/los-angeles-lakers-legend-kareem-abdul-jabbar-criticizes-some-lebron-james-actions
5,"NHL Highlights | Panthers vs. Sabres - Apr. 3, 2022 - SPORTSNET",https://i.ytimg.com/vi/EASqoTvjxuw/hqdefault.jpg,https://www.youtube.com/watch?v=EASqoTvjxuw
6,Luka Doncic (32 Points) at Milwaukee Bucks - Dallas Mavericks,https://i.ytimg.com/vi/ZCeejgAtNZs/hqdefault.jpg,https://www.youtube.com/watch?v=ZCeejgAtNZs
7,Tiger Woods: 'Game-Time Decision' Whether He Plays Masters - Golf Channel,https://www.golfchannel.com/themes/custom/golfchannel/img/GCLogo.png,https://www.golfchannel.com/news/tiger-woods-game-time-decision-whether-he-plays-masters
8,Fantasy Baseball Rankings 2022: Breakouts from proven model that called Vladimir Guerrero Jr.'s big year - CBS Sports,https://sportshub.cbsistatic.com/i/r/2021/08/09/19e1299e-f904-42cf-a7bb-f4f1810c91fb/thumbnail/1200x675/61a862f1a887c97d13d63df257f5c78a/josiah-gray.jpg,https://www.cbssports.com/fantasy/baseball/news/fantasy-baseball-rankings-2022-breakouts-from-proven-model-that-called-vladimir-guerrero-jr-s-big-year/
9,How Aaron Judge feels about Carlos Beltran ahead of Yankees return - New York Post ,https://nypost.com/wp-content/uploads/sites/2/2022/04/Aaron-Judge-Carlos-Beltran.jpg?quality=75&strip=all&w=1024,https://nypost.com/2022/04/03/how-aaron-judge-feels-about-carlos-beltran-before-yankees-return/
10,"Shogo Akiyama doesn't make Cincinnati Reds roster, likely to become a free agent - The Cincinnati Enquirer","https://www.gannett-cdn.com/presto/2021/09/24/PCIN/ba86fdde-118d-470d-b2b6-57aff54419ae-092321_REDS_0111.jpg?auto=webp&crop=3722,2094,x0,y189&format=pjpg&width=1200",https://www.cincinnati.com/story/sports/mlb/reds/2022/04/03/shogo-akiyama-does-not-make-2022-cincinnati-reds-opening-day-roster/7261243001/
11,Mathieu van der Poel Feels Bad That Pogacar Misses Podium - FloBikes,https://i.ytimg.com/vi/Bif9FzXRqaI/maxresdefault.jpg,https://www.youtube.com/watch?v=Bif9FzXRqaI
12,"Frank Gore says he'll sign 1-day contract, retire with 49ers after 16 seasons in NFL - Fox News",https://static.foxnews.com/foxnews.com/content/uploads/2021/11/GettyImages-460878738.jpg,https://www.foxnews.com/sports/frank-gore-sign-contract-retire-san-francisco-49ers-16-seasons
13,"Detroit Pistons sign Carsen Edwards and Braxton Key, waive Chris Smith - Detroit Free Press","https://www.gannett-cdn.com/presto/2022/04/03/PDTF/add20fbf-db4e-4cbe-a422-0e41cbd84e96-USATSI_16578423.jpg?auto=webp&crop=3599,2024,x0,y0&format=pjpg&width=1200",https://www.freep.com/story/sports/nba/pistons/2022/04/03/detroit-pistons-carsen-edwards-chris-smith-braxton-key/7262472001/
14,UConn and South Carolina set to battle for the NCAA women's basketball title - CNN,https://cdn.cnn.com/cnnnext/dam/assets/220403125116-boston-bueckers-super-tease.jpg,https://www.cnn.com/2022/04/03/sport/uconn-south-carolina-womens-ncaa-title/index.html
15,Commanders allegedly kept ticket revenue meant for visiting NFL teams - New York Post ,https://nypost.com/wp-content/uploads/sites/2/2022/04/1368205177-e1649006011336.jpg?quality=75&strip=all&w=1024,https://nypost.com/2022/04/03/commanders-allegedly-kept-ticket-revenue-from-other-nfl-teams/
16,Seahawks' DK Metcalf could reportedly be available in a trade at the right price - CBS Sports,https://sportshub.cbsistatic.com/i/r/2021/12/01/f15a62f6-6e4c-44be-8169-c129d4247335/thumbnail/1200x675/2ef64fcdb017b7ce5c2ce76a5e4c0106/dk-metcalf-1400.jpg,https://www.cbssports.com/nfl/news/seahawks-dk-metcalf-could-reportedly-be-available-in-a-trade-at-the-right-price/
17,Tottenham 5-1 Newcastle: Spurs roll after second half goal spree - Cartilage Free Captain,https://cdn.vox-cdn.com/thumbor/RofjVDxJPkSmsNjD7Onnk8Kyh5A=/0x0:3946x2066/fit-in/1200x630/cdn.vox-cdn.com/uploads/chorus_asset/file/23364426/1389332002.jpg,https://cartilagefreecaptain.sbnation.com/2022/4/3/23008779/tottenham-5-1-newcastle-spurs-roll-after-second-half-goal-spree
18,Butler basketball brings Thad Matta back as head coach - IndyStar,"https://www.gannett-cdn.com/presto/2022/03/14/PGRE/37e2f661-3ca8-42df-baf3-428ca2dee66c-USATSI_9858689.jpg?auto=webp&crop=2999,1687,x0,y0&format=pjpg&width=1200",https://www.indystar.com/story/sports/college/butler/2022/04/03/butler-basketball-hires-thad-matta-head-coach-replace-lavall-jordan/7262368001/
19,Mavericks @ Bucks | NBA on ABC Live Scoreboard - NBA,https://i.ytimg.com/vi/rtIOwafrhYg/maxresdefault_live.jpg,https://www.youtube.com/watch?v=rtIOwafrhYg
